asin,title,category_path,label
B00BAY3QCE,Long Sleeve Sheer Lace Up Bust Fitted Bodycon Evening Clubwear Cocktail Dress,"Clothing, Shoes & Jewelry -> Women -> Clothing -> Dresses",0
B006MRURIK,"C. Luce Women's Casual Flirty Dress, Black, Medium","Clothing, Shoes & Jewelry -> Women -> Clothing -> Dresses",0
B0006JAEM4,National Striped Nightshirts - Misses Woven,"Clothing, Shoes & Jewelry -> Women -> Clothing -> Lingerie, Sleep & Lounge",1
B00AJF72RK,"Tiana B Women's Boatneck Lace Dress, Ivory, X-Large","Clothing, Shoes & Jewelry -> Women -> Clothing -> Dresses",0
B00CA2CA9A,Intimate Portal Women's Menstrual Leak Proof Low Rise Sanitary Panty Pink Pale Pink Large (Pack of 2),"Clothing, Shoes & Jewelry -> Women -> Clothing -> Lingerie, Sleep & Lounge",1
B00CD91MSA,Torrid Plus Size Lace Push-Up Bra,"Clothing, Shoes & Jewelry -> Women -> Clothing -> Lingerie, Sleep & Lounge",1
B00FEA9VWO,"Cuddl Duds Women's Woodland Critters Micro Fleece Pajama Set, Sweet Birds, Large","Clothing, Shoes & Jewelry -> Women -> Clothing -> Lingerie, Sleep & Lounge",1
B00E7YNUEI,MOD Plus Women's Strapless Smocked Plus Size Maxi Dress Magenta 2XL(724P),"Clothing, Shoes & Jewelry -> Women -> Clothing -> Dresses",0
B006ZU1QCA,"Wrapper Juniors Cap Sleeve Scoop Neck Maxi Dress, Silver, X-Small/2","Clothing, Shoes & Jewelry -> Women -> Clothing -> Dresses",0
B00IGMJDW0,Karen Neuburger Womens Skyfall Ornate Nightgown X-Large Brocade blue,"Clothing, Shoes & Jewelry -> Women -> Clothing -> Lingerie, Sleep & Lounge",1
B006BIPY0G,"Karen Kane Women's Banded Maxi Dress, Print, Medium","Clothing, Shoes & Jewelry -> Women -> Clothing -> Dresses",0
B001NEKB4W,Warner's Women's Invisible Bliss Wire-Free Bra,"Clothing, Shoes & Jewelry -> Women -> Clothing -> Lingerie, Sleep & Lounge",1
B009YF34R8,"Hello Kitty Junior's Hk Full Body Night Shirt, Black, Medium","Clothing, Shoes & Jewelry -> Women -> Clothing -> Lingerie, Sleep & Lounge",1
B009LDY0PI,"ERIN erin fetherston Women's Allover Sequin Dress, Black/Silver, 0","Clothing, Shoes & Jewelry -> Women -> Clothing -> Dresses",0
B00BPFJTU6,SEVEN TIL MIDNIGHT STM-9769 Lurex Lace Open Crotch Panty,"Clothing, Shoes & Jewelry -> Women -> Clothing -> Lingerie, Sleep & Lounge",1
B00AXYC0Y2,Fruit of the Loom Women's 6-Pack Assorted Color Nylon Briefs 6DN220B,"Clothing, Shoes & Jewelry -> Women -> Clothing -> Lingerie, Sleep & Lounge",1
B00J59NVTE,Jones New York Women's Plus-Size Pleated Tank Dress,"Clothing, Shoes & Jewelry -> Women -> Clothing -> Dresses",0
B00CHHLY8Q,Wet Seal Women's Solid Chiffon Maxi Dress L Hibiscus,"Clothing, Shoes & Jewelry -> Women -> Clothing -> Dresses",0
B00JIUSU64,Nautical Pinup Rockabilly Vintage Retro Pencil Women's Dress Navy Black,"Clothing, Shoes & Jewelry -> Women -> Clothing -> Dresses",0
B00A89070Q,"London Times Women's Sleeveless Shutter Dress, Aqua, 6","Clothing, Shoes & Jewelry -> Women -> Clothing -> Dresses",0
B00D75WTL8,Vintage Women Lace Sleeveless Slim Floral Party Evening Tunic Mini Dress,"Clothing, Shoes & Jewelry -> Women -> Clothing -> Dresses",0
B00EE8QP4O,Sofishie Women's Bohemian V Shape Long Maxi Dress with Floral Print,"Clothing, Shoes & Jewelry -> Women -> Clothing -> Dresses",0
B0095D4KT0,"Suzi Chin Women's Sheath Dress, Nightfall, 6","Clothing, Shoes & Jewelry -> Women -> Clothing -> Dresses",0
B00GNU6A8C,Miusol Celebrity Kim Egypt Gold Foil Print Long Sleeve Bodycon Dress,"Clothing, Shoes & Jewelry -> Women -> Clothing -> Dresses",0
B00KV3YPMA,Lotustraders Dress Maxi Smocked Pocket Boho T653,"Clothing, Shoes & Jewelry -> Women -> Clothing -> Dresses",0
B00I3F2NL8,Lindy Bop 'Audrey' Hepburn Style Vintage 1950's Pastel Rockabilly Swing Dress,"Clothing, Shoes & Jewelry -> Women -> Clothing -> Dresses",0
B007QWU564,GLAMORISE 9500 - Elegance Body Briefer Shaper Firm Control Bodysuit,"Clothing, Shoes & Jewelry -> Women -> Clothing -> Lingerie, Sleep & Lounge",1
B002EALY4K,1 World Sarongs Womens Long Summer Embroidered Dress in White - NO RETURNS,"Clothing, Shoes & Jewelry -> Women -> Clothing -> Dresses",0
B00ATGHCEW,Pinkclubwear Black Mesh Shoulder Faux Leather Peplum Mini-Black-Medium,"Clothing, Shoes & Jewelry -> Women -> Clothing -> Dresses",0
B00D328GYE,Luxury Lane Lace Bra &amp; Skirted Thong 2-Piece Set,"Clothing, Shoes & Jewelry -> Women -> Clothing -> Lingerie, Sleep & Lounge",1
B00HUNMWHE,Tragarse Ladies Camisole Sexy Gauze Backless Teddies Lingerie ML8061,"Clothing, Shoes & Jewelry -> Women -> Clothing -> Lingerie, Sleep & Lounge",1
B00A3BVQDQ,"OverBra Women's Back Support Enhance Cleavage Longline Shapewear, XL-Nude","Clothing, Shoes & Jewelry -> Women -> Clothing -> Lingerie, Sleep & Lounge",1
B00JB3R3HK,Ever Beauty Women's Short Taffeta Pick-Up Bubble Dress,"Clothing, Shoes & Jewelry -> Women -> Clothing -> Dresses",0
B0038Q00YE,SPANX Slimplicity Lingerie Strap Camisoles,"Clothing, Shoes & Jewelry -> Women -> Clothing -> Lingerie, Sleep & Lounge",1
B00CAMMHE8,Mermaid Women's Evening Dress,"Clothing, Shoes & Jewelry -> Women -> Clothing -> Dresses",0
B002TJW4UO,"Stretch Jersey Knee-length Party Cocktail Dress Sequin Trim, 5X, Blue","Clothing, Shoes & Jewelry -> Women -> Clothing -> Dresses",0
B00DN2EV52,"Tiana B Women's Charmeuse Twofer Dress with Skinny Belt, Rose, 10","Clothing, Shoes & Jewelry -> Women -> Clothing -> Dresses",0
B0052T8YK2,Incognito Slip Skirt,"Clothing, Shoes & Jewelry -> Women -> Clothing -> Lingerie, Sleep & Lounge",1
B00ENXTRYA,Ever Pretty High Stretch Cowl Neckline Blue Mini Fitted Cocktail Dress 03629,"Clothing, Shoes & Jewelry -> Women -> Clothing -> Dresses",0
B00JB71H2S,eShakti Women's Chelsea dress L-12 Regular Sunset yellow,"Clothing, Shoes & Jewelry -> Women -> Clothing -> Dresses",0
B0031UUJG6,Timpa Duet Lace Underwire Demi Bra Beige,"Clothing, Shoes & Jewelry -> Women -> Clothing -> Lingerie, Sleep & Lounge",1
B00B761M2G,2 Pack: CC 6&quot; Wide Lace Bandeau Set,"Clothing, Shoes & Jewelry -> Women -> Clothing -> Lingerie, Sleep & Lounge",1
B00KJ0TUIE,Twin Birds Women's Polka Dot Scoop Neck Spaghetti Cami,"Clothing, Shoes & Jewelry -> Women -> Clothing -> Lingerie, Sleep & Lounge",1
B00CE5BXDC,Wacoal Women's Cotton Suede Tailored Hi Cut Panty Pant,"Clothing, Shoes & Jewelry -> Women -> Clothing -> Lingerie, Sleep & Lounge",1
B00JFLGTUK,QinYing Party Underwear Waist Cincher Bustier Underbust Boned Corset,"Clothing, Shoes & Jewelry -> Women -> Clothing -> Lingerie, Sleep & Lounge",1
B00G31TIS0,Hawaiian Muumuu Dress Pink &amp; Brown (2XL),"Clothing, Shoes & Jewelry -> Women -> Clothing -> Dresses",0
B00AKOV1CW,"KAMALIKULTURE Women's Long Sleeve Side Draped Dress, Green/Black/Off-White, Small","Clothing, Shoes & Jewelry -> Women -> Clothing -> Dresses",0
B00550PUNC,Bali Women's Bali Comfort Revolution Wire-Free Bra,"Clothing, Shoes & Jewelry -> Women -> Clothing -> Lingerie, Sleep & Lounge",1
B00CMKKDSU,PattyBoutik Bolero Tube Style Sweetheart Long Sleeve Stretch Casual Party Dress,"Clothing, Shoes & Jewelry -> Women -> Clothing -> Dresses",0
B003YYLP58,JC Waffle Knit Pleated Boat Neck Pocket Dress Beige M,"Clothing, Shoes & Jewelry -> Women -> Clothing -> Dresses",0
B008CEXWP6,Bloom's Outlet Sexy Lingerie Metallic Shiny Red Mini Dress Clubwear CMJ518 Red M,"Clothing, Shoes & Jewelry -> Women -> Clothing -> Dresses",0
B00B7PFJS0,"G2 Fashion Square Floral Printed Ruffled Spring Dress(DRS-CAS,OWH-L)","Clothing, Shoes & Jewelry -> Women -> Clothing -> Dresses",0
B00E7JTIT4,Franato Women's Seamless Sport Bra,"Clothing, Shoes & Jewelry -> Women -> Clothing -> Lingerie, Sleep & Lounge",1
B00A3UT82I,Skelapparel Gothic Lolita Black Belted Military Swing Dress,"Clothing, Shoes & Jewelry -> Women -> Clothing -> Dresses",0
B000UM0YLI,Glam Attack Women's Short Club Halter Dress,"Clothing, Shoes & Jewelry -> Women -> Clothing -> Dresses",0
B0085CAHLC,"Karen Neuburger Women's Plus-Size Pop Long Sleeve Henley Nightshirt, Plaid Cream, XX-Large","Clothing, Shoes & Jewelry -> Women -> Clothing -> Lingerie, Sleep & Lounge",1
B00IYCMRJ8,Womens Celeb Ladies Bodycon Dark Blue Cap Sleeve Lace Midi Evening Party Dress,"Clothing, Shoes & Jewelry -> Women -> Clothing -> Dresses",0
B00CRNOAY0,Comic Print Mini Dress,"Clothing, Shoes & Jewelry -> Women -> Clothing -> Dresses",0
B0012J074C,"Wacoal Women's Balconette Bra,Naturally Nude,32AA","Clothing, Shoes & Jewelry -> Women -> Clothing -> Lingerie, Sleep & Lounge",1
B00B7GJGOM,Womens Barbi Cap Sleeve Midi Dress (8/10 (uk 12/14)),"Clothing, Shoes & Jewelry -> Women -> Clothing -> Dresses",0
B00E8X36JW,Franato Women's Control Slimming Shapewear Suit,"Clothing, Shoes & Jewelry -> Women -> Clothing -> Lingerie, Sleep & Lounge",1
B001AP5BO4,"Moving Comfort Women's Dori Bra,Ocean,Large","Clothing, Shoes & Jewelry -> Women -> Clothing -> Lingerie, Sleep & Lounge",1
B00ED374K4,Ixia Women's Polka Dot Fold Over Pinup Dress,"Clothing, Shoes & Jewelry -> Women -> Clothing -> Dresses",0
B0007QMKBY,Flexees by Maidenform Women's Instant-Slimmer Waist Nipper #6868,"Clothing, Shoes & Jewelry -> Women -> Clothing -> Lingerie, Sleep & Lounge",1
B004CO3368,"Just My Size Women's P4 Nylon Brief, 11-Assorted","Clothing, Shoes & Jewelry -> Women -> Clothing -> Lingerie, Sleep & Lounge",1
B00C1R2YPO,Leopard Push-up Bra and Boyshort Panty Set,"Clothing, Shoes & Jewelry -> Women -> Clothing -> Lingerie, Sleep & Lounge",1
B00398PGI6,Vanity Fair Women's Perfectly Yours Seamfree Tailored Brief Panty,"Clothing, Shoes & Jewelry -> Women -> Clothing -> Lingerie, Sleep & Lounge",1
B00DGFICRY,"Corset Super Store Women's Steampunk Corset, Jacket, and Belt","Clothing, Shoes & Jewelry -> Women -> Clothing -> Lingerie, Sleep & Lounge",1
B00E0XCRYA,MOD 20 Women's Polka Dot Embossed Dress Green M(1563),"Clothing, Shoes & Jewelry -> Women -> Clothing -> Dresses",0
B00C61OQ10,"Jax Women's Bodycon Jersey Dress With Lace Detail, Fog/Black, 8","Clothing, Shoes & Jewelry -> Women -> Clothing -> Dresses",0
B005C82PEE,Dr. Rey Shapewear Women's Push Up Plunge Bra,"Clothing, Shoes & Jewelry -> Women -> Clothing -> Lingerie, Sleep & Lounge",1
B00D5KQHI6,Ever Pretty Sexy Red One Shoulder Split Ruffles Long Evening Dress 09898,"Clothing, Shoes & Jewelry -> Women -> Clothing -> Dresses",0
B00EETDRDA,"Gabby Skye Women's Elbow Sleeve Solid Flare Dress, Hunter, 10","Clothing, Shoes & Jewelry -> Women -> Clothing -> Dresses",0
B00FAP5YWE,"KAMALIKULTURE Women's Cross Halter Gown, Black/Off White Spinning Wheels, X-Large","Clothing, Shoes & Jewelry -> Women -> Clothing -> Dresses",0
B005NQMCMU,Only Necessities Women's Plus Size Flannel Snap Front Lounger Nightgown,"Clothing, Shoes & Jewelry -> Women -> Clothing -> Lingerie, Sleep & Lounge",1
B007V0B8IU,"London Times Women's Shimmer Starburst Shutter Tuck Dress, Sangria, 8","Clothing, Shoes & Jewelry -> Women -> Clothing -> Dresses",0
B000OTRFIM,Carnival Womens Full Figure Satin Torselette Bra,"Clothing, Shoes & Jewelry -> Women -> Clothing -> Lingerie, Sleep & Lounge",1
B004G09N2G,Maidenform Womens' Pure Genius Extra Coverage Tailored Bra,"Clothing, Shoes & Jewelry -> Women -> Clothing -> Lingerie, Sleep & Lounge",1
B004ZY06UQ,"Smocked Sundress - Women's Sizes, Color Sage, Size 2X","Clothing, Shoes & Jewelry -> Women -> Clothing -> Dresses",0
B0091C68MW,"Bobi Women's Supreme Ruffle Button Front Dress, Black, X-Large","Clothing, Shoes & Jewelry -> Women -> Clothing -> Dresses",0
B005COI4HA,Playgirl Turquoise Blue Floral Jacquard Full Steel Boned Overbust Corset Shaper,"Clothing, Shoes & Jewelry -> Women -> Clothing -> Lingerie, Sleep & Lounge",1
B00EDQMQCM,Barbra Lingerie Women's Satin Full Coverage Brief Panties (6 Pack),"Clothing, Shoes & Jewelry -> Women -> Clothing -> Lingerie, Sleep & Lounge",1
B00DEBO4D6,"London Times Women's Plus-Size Short Sleeve Lace Dress, Grey/Black, 14W","Clothing, Shoes & Jewelry -> Women -> Clothing -> Dresses",0
B008195I3Q,DC Comics Wonder Woman String Bikini Superhero (XLarge),"Clothing, Shoes & Jewelry -> Women -> Clothing -> Lingerie, Sleep & Lounge",1
B00GM5LQG4,Urban Identity Women's Framed Bodycon Sheath Evening Party Dress,"Clothing, Shoes & Jewelry -> Women -> Clothing -> Dresses",0
B009FLHX64,Jessie Steele Brown and Pink Deco Dot Boyfriend Nightshirt (Med),"Clothing, Shoes & Jewelry -> Women -> Clothing -> Lingerie, Sleep & Lounge",1
B008BVHWVU,Old Shanghai Women's Kimono Robe - Peacock &amp; Blossoms (Long),"Clothing, Shoes & Jewelry -> Women -> Clothing -> Lingerie, Sleep & Lounge",1
B00E9MS6LA,"Danny &amp; Nicole Women's Rouched Sleeve Gathered Front Dress, Lapis, 14","Clothing, Shoes & Jewelry -> Women -> Clothing -> Dresses",0
B00631VM70,Alexander Del Rossa Women's Romeo and Juliet Bell Sleeve Victorian Nightgown,"Clothing, Shoes & Jewelry -> Women -> Clothing -> Lingerie, Sleep & Lounge",1
B00DEJR890,"Jockey Womens Long Pant, Sicily Stripe, Small","Clothing, Shoes & Jewelry -> Women -> Clothing -> Lingerie, Sleep & Lounge",1
B00HJANIF8,2LUV Plus Women's Floral Sleeveless Sheath Plus Size Dress Navy Xl(JD5583),"Clothing, Shoes & Jewelry -> Women -> Clothing -> Dresses",0
B002KPJ21Q,The Natural Racer Back Clips (4338),"Clothing, Shoes & Jewelry -> Women -> Clothing -> Lingerie, Sleep & Lounge",1
B00IJEXG28,Cute Summer Pineapple Print A-Line Retro Dress,"Clothing, Shoes & Jewelry -> Women -> Clothing -> Dresses",0
B00B89LGFK,Koh Koh Women's Strapless Shoulderless Sleeveless Summer Ruffled Maxi Dress,"Clothing, Shoes & Jewelry -> Women -> Clothing -> Dresses",0
B00CF1M492,"Jack Juniors Darrington Rose Pattern Knit Jacquard Dress, Maroon, 8","Clothing, Shoes & Jewelry -> Women -> Clothing -> Dresses",0
B0093KV5IO,Bslingerie Womens Purple Gold Brocade Boned Bustier Corset,"Clothing, Shoes & Jewelry -> Women -> Clothing -> Lingerie, Sleep & Lounge",1
B00EAYFUTS,Velvet Kitten Violet Scallop Satin Chemise Set #3127 (Small/Medium),"Clothing, Shoes & Jewelry -> Women -> Clothing -> Lingerie, Sleep & Lounge",1
B00BQ95J28,Spring Temperament Sequins Peter Pan Collar Waisted Tops Tiny Dress,"Clothing, Shoes & Jewelry -> Women -> Clothing -> Dresses",0
B00EW6JZ4A,Stanzino Women's High Slit Sleeveless Long Dress BLACK S,"Clothing, Shoes & Jewelry -> Women -> Clothing -> Dresses",0
B00EYIN22C,Brinley Co Juniors Striped Racerback Maxi Dress,"Clothing, Shoes & Jewelry -> Women -> Clothing -> Dresses",0
B005X95SKU,"David Lerner Women's Triangle Sleeve Dress, Black, Small","Clothing, Shoes & Jewelry -> Women -> Clothing -> Dresses",0
B00GP46TGO,"TRIXXI Draped Crystal Halter Dress w/ Rouching Panels [262799E841], BLK, LRG","Clothing, Shoes & Jewelry -> Women -> Clothing -> Dresses",0
B00008KH9C,SPANX POWER PANTIES Style# 004,"Clothing, Shoes & Jewelry -> Women -> Clothing -> Lingerie, Sleep & Lounge",1
B00CLYB0W0,JoeyBra Fashion,"Clothing, Shoes & Jewelry -> Women -> Clothing -> Lingerie, Sleep & Lounge",1
B00COW1KJC,Siluet Cocoa Capuchina Colombian Girdle for Esthetic Treatments with Wide Straps,"Clothing, Shoes & Jewelry -> Women -> Clothing -> Lingerie, Sleep & Lounge",1
B00D5BNUCG,"Bohemian Style Flower Printed Short-sleeved Chiffon Long Dress (16, Pink)","Clothing, Shoes & Jewelry -> Women -> Clothing -> Dresses",0
B003DQPV84,"Lucy Love Juniors Knock-Out Dress,Plum Crazy,XS (3)","Clothing, Shoes & Jewelry -> Women -> Clothing -> Dresses",0
B007GBK6BY,The Irish Linen Store Womens Molly Short Sleeve Cotton Nightgown White,"Clothing, Shoes & Jewelry -> Women -> Clothing -> Lingerie, Sleep & Lounge",1
B002Q0QYIY,Big Feet Pjs Pink Camo Micro-polar Fleece Adult Footed Pajamas w/ Drop Seat,"Clothing, Shoes & Jewelry -> Women -> Clothing -> Lingerie, Sleep & Lounge",1
B00854ZKCG,ToBeInStyle Women's Self Adhesive Silicone Breast Cover Pad,"Clothing, Shoes & Jewelry -> Women -> Clothing -> Lingerie, Sleep & Lounge",1
B006ACAY0I,Low Crown Hiker Hat,"Clothing, Shoes & Jewelry -> Women -> Clothing -> Dresses",0
B00IFMJYAW,Ann Michell Women's Full Vest Workout Latex Waist Cincher Sport Girdle Band,"Clothing, Shoes & Jewelry -> Women -> Clothing -> Lingerie, Sleep & Lounge",1
B004P5OW6E,"Vanity Fair Women's Illumination Leisure Bra, Sweet Cream, Large","Clothing, Shoes & Jewelry -> Women -> Clothing -> Lingerie, Sleep & Lounge",1
B00B89OFY4,Koh Koh Women's One Shoulder Cocktail Evening Elegant Long Maxi Dress,"Clothing, Shoes & Jewelry -> Women -> Clothing -> Dresses",0
B0036DDZNC,"Corey Lynn Calter Women's Kelly Ruffle Front Shift Dress,Orchid,4","Clothing, Shoes & Jewelry -> Women -> Clothing -> Dresses",0
B00C6PP86S,Ever-Pretty V-Neck Cross Back Dress 90080118,"Clothing, Shoes & Jewelry -> Women -> Clothing -> Dresses",0
B001K66P2K,Dritz Sew-In Bra - C Cup,"Clothing, Shoes & Jewelry -> Women -> Clothing -> Lingerie, Sleep & Lounge",1
B00G71HK3Q,"Wrapped Two Tone Dress in Beige and Blue, Small","Clothing, Shoes & Jewelry -> Women -> Clothing -> Dresses",0
B00GX4OUIK,"HotEnergy 1 Set Lace Garter Belt Panties &amp; Sheer Stockings,USA Seller Fast Shipping","Clothing, Shoes & Jewelry -> Women -> Clothing -> Lingerie, Sleep & Lounge",1
B004I43FL0,"Barely There Women's Barely There No Slip Fit Underwire Bra,Warm Streel Lace,38B","Clothing, Shoes & Jewelry -> Women -> Clothing -> Lingerie, Sleep & Lounge",1
B001E8XULI,RJC Womens Fern Leaf Garden Bias Cut Slip Sundress,"Clothing, Shoes & Jewelry -> Women -> Clothing -> Dresses",0
B00GI9L3JE,Emma Y Empire Waist Short Sleeves Formal Gowns Maxi Dresses 2013- US Size 12-Grape,"Clothing, Shoes & Jewelry -> Women -> Clothing -> Dresses",0
B002T1FV5C,Moving Comfort Women's Juno Bra,"Clothing, Shoes & Jewelry -> Women -> Clothing -> Lingerie, Sleep & Lounge",1
B00B2B96RO,G2 Chic Women's Solid Satin Plunging Bra,"Clothing, Shoes & Jewelry -> Women -> Clothing -> Lingerie, Sleep & Lounge",1
B00AFXL2BI,Allegra K Women Off Shoulder Design Shirred Side Batwing Sleeve Fashional Dress,"Clothing, Shoes & Jewelry -> Women -> Clothing -> Dresses",0
B009AO2J74,KAMALIKULTURE Women's Short Sleeve Sweetheart Draped Dress,"Clothing, Shoes & Jewelry -> Women -> Clothing -> Dresses",0
B0032PDY4E,Party Dress New Designer Long Gown Sizes 4-14 #2635,"Clothing, Shoes & Jewelry -> Women -> Clothing -> Dresses",0
B005VPLS00,Seamless Wirefree Leisure Bra by Comfort Choice,"Clothing, Shoes & Jewelry -> Women -> Clothing -> Lingerie, Sleep & Lounge",1
B00AM1897I,LOLE Women's Easy Dress,"Clothing, Shoes & Jewelry -> Women -> Clothing -> Dresses",0
B00CZ6G09C,"AGB Women's Print Dress with Belt, Multi, 8","Clothing, Shoes & Jewelry -> Women -> Clothing -> Dresses",0
B00GM5PZU2,Nomad Flocked Dot Boxer Set,"Clothing, Shoes & Jewelry -> Women -> Clothing -> Lingerie, Sleep & Lounge",1
B00GH9UZYE,H&amp;R London Women's Mini Polka Dot Halter Swing Dress,"Clothing, Shoes & Jewelry -> Women -> Clothing -> Dresses",0
B003FGWQVC,"Maidenform Women's Ultimate Push Up Bra,Black,34B","Clothing, Shoes & Jewelry -> Women -> Clothing -> Lingerie, Sleep & Lounge",1
B0083X036M,Hailey Jeans Co. Womens Ruffled Flower Detail Satin Nightgown,"Clothing, Shoes & Jewelry -> Women -> Clothing -> Lingerie, Sleep & Lounge",1
B004HW85PE,Moving Comfort Womens Serena Bra,"Clothing, Shoes & Jewelry -> Women -> Clothing -> Lingerie, Sleep & Lounge",1
B00DZ19HDC,"143Fashion Ladies Fashion Sleeveless Maxi Dress, Olive/Navy, Medium","Clothing, Shoes & Jewelry -> Women -> Clothing -> Dresses",0
B00B513SUM,G2 Chic Women's Glitzy Tassle &amp; Fleur Print Dress,"Clothing, Shoes & Jewelry -> Women -> Clothing -> Dresses",0
B00D7EEUB6,Cinema Etoile Women's Point D'Espirit Molded Cup Babydoll,"Clothing, Shoes & Jewelry -> Women -> Clothing -> Lingerie, Sleep & Lounge",1
B00CQ09SAU,"London Times Women's 3/4 Sleeve Printed Scuba Sheath Dress, White/Black, 10","Clothing, Shoes & Jewelry -> Women -> Clothing -> Dresses",0
B00CIUB9YQ,Trixxi Juniors Print-Challis Maxi Dress,"Clothing, Shoes & Jewelry -> Women -> Clothing -> Dresses",0
B00CL89QZY,Curvy Kate Women's Starlet Bra,"Clothing, Shoes & Jewelry -> Women -> Clothing -> Lingerie, Sleep & Lounge",1
B0081FYUC0,Russell Athletic Women's Reversible Sports Bra,"Clothing, Shoes & Jewelry -> Women -> Clothing -> Lingerie, Sleep & Lounge",1
B00JZUOC28,Kawen Women's Vintage Chiffon Floral Sleeveless Long Maxi Dress,"Clothing, Shoes & Jewelry -> Women -> Clothing -> Dresses",0
B009CGGI18,Only Necessities Women's Plus Size Long Zip Front A-Line Microfleece Robe,"Clothing, Shoes & Jewelry -> Women -> Clothing -> Lingerie, Sleep & Lounge",1
B004RM1EES,Dr. Rey Shapewear Women's Firm Control Tummy Tank,"Clothing, Shoes & Jewelry -> Women -> Clothing -> Lingerie, Sleep & Lounge",1
B00CI82J60,"Snap Front Duster w/Lace Yoke - Missy, Color Pink, Size SM","Clothing, Shoes & Jewelry -> Women -> Clothing -> Lingerie, Sleep & Lounge",1
B00HZ5U44U,CC All Over Lace Push up Bra,"Clothing, Shoes & Jewelry -> Women -> Clothing -> Lingerie, Sleep & Lounge",1
B009K88NF2,"Karen Neuburger Women's Plus Paradise Cove Short Sleeve Crop Pant, Plaid Tangerine, 2X","Clothing, Shoes & Jewelry -> Women -> Clothing -> Lingerie, Sleep & Lounge",1
B00EJ2JTTS,Yvette Padded Underwire Women Sports Bra-Adjustable/Racerback/Criss cross,"Clothing, Shoes & Jewelry -> Women -> Clothing -> Lingerie, Sleep & Lounge",1
B00G9MNFKA,247 Frenzy Women's 12 Pack Polka Dot Bikini Panty (Large),"Clothing, Shoes & Jewelry -> Women -> Clothing -> Lingerie, Sleep & Lounge",1
B00K26BEE8,Sakkas Celestria Embroidered Rayon Dress,"Clothing, Shoes & Jewelry -> Women -> Clothing -> Dresses",0
B0085U3C0W,Barely There Women's Second Skinnies Slimmers Reversible Hi-Low Waist Slip,"Clothing, Shoes & Jewelry -> Women -> Clothing -> Lingerie, Sleep & Lounge",1
B00AVWOBDY,Big Sexy Lingerie Women's High Shine Luster Lace Brief Panty,"Clothing, Shoes & Jewelry -> Women -> Clothing -> Lingerie, Sleep & Lounge",1
B00B8AB5TG,Pink Fleece Nightgown for Women L,"Clothing, Shoes & Jewelry -> Women -> Clothing -> Lingerie, Sleep & Lounge",1
B00F20KR6A,On Trend Black and White Paris Long Maxi Dress Chevron 3/4 Sleeve (3XL),"Clothing, Shoes & Jewelry -> Women -> Clothing -> Dresses",0
B008P45422,Allegra K Women Casual Sleeveless Stripes Racer Back Mid-calf Tank Dress,"Clothing, Shoes & Jewelry -> Women -> Clothing -> Dresses",0
B00BIFH2PW,La Isla Women's Racer Back Level 4 Maximum Comfort Run Sports Bra,"Clothing, Shoes & Jewelry -> Women -> Clothing -> Lingerie, Sleep & Lounge",1
B00BWVWQFS,Wrapped In A Cloud Women's Plush Signature Marshmallow Spa Robe W20121026,"Clothing, Shoes & Jewelry -> Women -> Clothing -> Lingerie, Sleep & Lounge",1
B003AZ7WMQ,Ci Sono by Adi Floral Print Cotton Sundress,"Clothing, Shoes & Jewelry -> Women -> Clothing -> Dresses",0
B009CH5AKC,"G2 Fashion Square Sexy Sequined Party Dress(DRS-CLB,GLD-L)","Clothing, Shoes & Jewelry -> Women -> Clothing -> Dresses",0
B007MRZ946,Angelina Dozen-Pack Cotton Bikini with Lace and Rhinestones. #1180,"Clothing, Shoes & Jewelry -> Women -> Clothing -> Lingerie, Sleep & Lounge",1
B0089GNZNQ,Hollywood Exxtreme Cleavage? Front-Close Bra 38B White,"Clothing, Shoes & Jewelry -> Women -> Clothing -> Lingerie, Sleep & Lounge",1
B004ZF6TYC,"LAT Junior Fine Jersey V-Neck Tee Dress, LARGE, HEATHER(93/7)","Clothing, Shoes & Jewelry -> Women -> Clothing -> Dresses",0
B00AVWPD9K,High Shine Lace Boned &amp; Underwired Shelf Bra - Women's 32-34 Cups A-C,"Clothing, Shoes & Jewelry -> Women -> Clothing -> Lingerie, Sleep & Lounge",1
B003ZTHUGU,"Ladies Modesty Panels Set of 3 (Black, White &amp; Pink), Fashionable Cleavage Cover - (Laced - Simply Clip on to Your Bra Straps) - Gift Sets","Clothing, Shoes & Jewelry -> Women -> Clothing -> Lingerie, Sleep & Lounge",1
B00EOUHBHW,"Oscar De La Renta Classic Full Length Plush Zip Robe (Small, Purple/Leopard)","Clothing, Shoes & Jewelry -> Women -> Clothing -> Lingerie, Sleep & Lounge",1
B00E4PMGCW,"Stan Herman Women's Burnout Plush Robe, Black Cherry, X-Large","Clothing, Shoes & Jewelry -> Women -> Clothing -> Lingerie, Sleep & Lounge",1
B00HWGZ4ZQ,Ladies' Lounge Pants - Light Grey and Aqua Stripe - (2 Pack),"Clothing, Shoes & Jewelry -> Women -> Clothing -> Lingerie, Sleep & Lounge",1
B00AYXA6ZW,"Jones New York Women's Solid Shirtdress, Sunset Orange, 12","Clothing, Shoes & Jewelry -> Women -> Clothing -> Dresses",0
B00G9MHHT0,LADIES Bodycon Dress U Shaped Open Back Pencil Dress Black Medium,"Clothing, Shoes & Jewelry -> Women -> Clothing -> Dresses",0
B00EM4Q248,Hue Sleepwear Women's Two-Piece Thermal Pajama Set,"Clothing, Shoes & Jewelry -> Women -> Clothing -> Lingerie, Sleep & Lounge",1
B004YEN3I4,TROPICAL FLOWERS HAWAIIAN LONG TANK DRESS,"Clothing, Shoes & Jewelry -> Women -> Clothing -> Dresses",0
B00GFSXMBK,Danny &amp; Nicole Women's Stripe Dress with Structured Jacket,"Clothing, Shoes & Jewelry -> Women -> Clothing -> Dresses",0
B002OOO65U,Sexy Halter Dress - Plumeria Garden Hawaiian Aloha Crisscross Back Fitted Halter Sun Dress in Black - S,"Clothing, Shoes & Jewelry -> Women -> Clothing -> Dresses",0
B00GKC2078,Miusol Women's Keyhole with Metal Buckle Open-Chest Bodycon Pencil Party Dress,"Clothing, Shoes & Jewelry -> Women -> Clothing -> Dresses",0
B00CIX4XIM,Laura High Quality Purple Thong Perfect Fit #SL103016 (Small),"Clothing, Shoes & Jewelry -> Women -> Clothing -> Lingerie, Sleep & Lounge",1
B005DLCELY,Softies Turkish Terrycloth 52&quot; Pink Deluxe Turkish Shawl,"Clothing, Shoes & Jewelry -> Women -> Clothing -> Lingerie, Sleep & Lounge",1
B00A8GKWAE,"Three Dots Women's 1/2 Sleeve Dress, Multi, Medium","Clothing, Shoes & Jewelry -> Women -> Clothing -> Dresses",0
B00ES8RI3M,247 Frenzy Women's 12 Pack Allover Lace Boyshort Panties (X-Large),"Clothing, Shoes & Jewelry -> Women -> Clothing -> Lingerie, Sleep & Lounge",1
B007WA2QYY,Allegra K Women Deep U Neck Sleeveless Bare Back Coattails Dress,"Clothing, Shoes & Jewelry -> Women -> Clothing -> Dresses",0
B002SEEB7E,VASSARETTE Women's Lace Padded Push Up Bra,"Clothing, Shoes & Jewelry -> Women -> Clothing -> Lingerie, Sleep & Lounge",1
B00CRTCKHS,Wacoal Women's Casual Beauty Underwire,"Clothing, Shoes & Jewelry -> Women -> Clothing -> Lingerie, Sleep & Lounge",1
B004NYB6JI,Colorado Clothing Spa Long Sleeve Robe,"Clothing, Shoes & Jewelry -> Women -> Clothing -> Lingerie, Sleep & Lounge",1
